{
  "version": "1.0.0",
  "intent": "Canonical interface registry for cross-process contracts and legacy alignment.",
  "interfaces": [
    {
      "name": "CredentialRepository",
      "owner": "C0MMON",
      "consumers": [
        "H4ND",
        "HUN7ER"
      ],
      "contract": "Persist and retrieve credential records with balance, lock, and DPD fields.",
      "inputs": [
        "credential_id",
        "balance",
        "lock_state",
        "dpd"
      ],
      "outputs": [
        "credential_record"
      ],
      "stability": "legacy-compatible",
      "migration_notes": "Maintain adapters during credential refactor.",
      "namespace": "C0MMON.Interfaces"
    },
    {
      "name": "SignalRepository",
      "owner": "C0MMON",
      "consumers": [
        "H4ND",
        "HUN7ER"
      ],
      "contract": "Create and consume signal records for automation runs.",
      "inputs": [
        "signal_id",
        "game_id",
        "thresholds"
      ],
      "outputs": [
        "signal_record"
      ],
      "stability": "legacy-compatible",
      "migration_notes": "Dual-run with NewSignal until cutover.",
      "namespace": "C0MMON.Interfaces"
    },
    {
      "name": "AutomationRunner",
      "owner": "H4ND",
      "consumers": [
        "H4ND"
      ],
      "contract": "Execute browser automation against configured game portals.",
      "inputs": [
        "portal_url",
        "credential",
        "signal"
      ],
      "outputs": [
        "run_result"
      ],
      "stability": "internal",
      "migration_notes": "Keep UI assumptions co-located in game helpers."
    },
    {
      "name": "ForecastEngine",
      "owner": "HUN7ER",
      "consumers": [
        "HUN7ER"
      ],
      "contract": "Compute DPD and jackpot forecasts and emit signals.",
      "inputs": [
        "credential_records",
        "game_records"
      ],
      "outputs": [
        "jackpot_records",
        "signal_records"
      ],
      "stability": "internal",
      "migration_notes": "Track model changes in Codex/Reports."
    }
  ],
  "notes": [
    "Interfaces are documentation-first; code alignment follows during refactors.",
    "Any breaking change requires a migration note and rollback plan."
  ]
}
